Case_ID,Submitted_Date,Customer_Name,Customer_Email,Order_ID,Product,Product_Category,Purchase_Date,Months_Since_Purchase,Damage_Type,Photos_Attached,Race_Or_Event,Customer_Tier,Lifetime_Orders,Lifetime_Spend_GBP,Claim_Type,Claim_Subtotal_GBP,Proposed_Tier,Tier_Reason,Decision,Decision_Date,Replacement_SKU,Customer_Pays_GBP,Shipped_Date,Days_To_Resolve,Customer_Followup,Notes
CR-2026-0001,2026-03-12,Beth Allen,beth.allen@example.com,4521-3,Vahla Range Storm Shell,outerwear,2024-10-15,17,crash damage,yes,UTMB Mont-Blanc 2026,returning,4,540,crash_replacement,260,Tier 1,Within 3yr crash window plus repeat customer,approved,2026-03-13,VAH-SS-RED-M,130,2026-03-17,5,sent_satisfaction_survey,Clean evidence multiple photos
CR-2026-0002,2026-03-14,Mark Riley,mark.riley@example.com,4488-1,Cascadia Trail Shoe v3,footwear,2025-08-22,7,wear out premature,yes,training,first_time,1,140,wear_out_replacement,140,Tier 2,Premature midsole compression within 12mo,approved,2026-03-15,CAS-TS3-BLK-44,42,2026-03-19,5,offered_trail_club_invite,Photos showed compression below acceptable
CR-2026-0003,2026-03-15,Jordan Pierce,jordan.p@example.com,4501-2,Cascadia Trail Shoe v3,footwear,2025-06-10,9,wear out claim,partial,training,first_time,1,140,wear_out_replacement,140,human_review,Photos unclear, race verification absent,pending,,,,,,Photos resubmitted required
CR-2026-0004,2026-03-16,Saoirse Burns,saoirse@cascadia-endurance.com,athlete-2026,Vahla Range Carbon Pack,packs,2025-11-04,4,defect,yes,Lavaredo training camp,ambassador,6,0,defect_warranty,320,Tier 3,Manufacturing defect ambassador,approved,2026-03-16,VAH-CP-V2,0,2026-03-17,1,programme_story_consent_requested,Front zipper failure
CR-2026-0005,2026-03-18,Anya Hassan,anya.hassan@example.com,4612-1,Cascadia Race Vest,packs,2024-01-08,26,crash damage,yes,Trail Club Wales 2026,returning,3,420,crash_replacement,180,Tier 2,Outside 24mo crash window edge case,approved,2026-03-19,CAS-RV-2026-S,90,2026-03-23,5,added_to_loyalty_segment,Edge case escalated to human review approved
CR-2026-0006,2026-03-19,Tom Vaughn,tom.vaughn@example.com,4633-1,Cascadia Trail Shoe v3,footwear,2026-01-22,2,wear out claim,yes,not race,first_time,1,140,wear_out_replacement,140,decline,Excessive wear pattern suggests off use,pending_human,2026-03-21,,,,,,Pattern flagged photos show road wear
CR-2026-0007,2026-03-22,Lila Okafor,lila.o@example.com,4666-2,Vahla Range Storm Shell,outerwear,2023-09-04,30,crash damage,yes,Ultra Trail Cape Town 2026,returning,5,720,crash_replacement,260,Tier 1,Repeat customer 5+ orders strong evidence,approved,2026-03-23,VAH-SS-CHAR-L,90,2026-03-27,5,asked_to_share_story_with_consent,Strong customer story potential
CR-2026-0008,2026-03-24,Yusuf Kahn,yusuf.kahn@example.com,4701-1,Cascadia Bib Shorts,apparel,2024-04-12,23,wear out claim,yes,training,first_time,1,85,wear_out_replacement,85,Tier 2,Within standard chamois life decline politely,approved,2026-03-25,CAS-BS-BLK-L,34,2026-03-29,5,offered_discount_code,
